Java J2EE Developer Skills,Python Developer Skills,Frontend Developer,Java Backend Developer,Java Full Stack Developer,.Net Developer,.Net Full Stack Developer,Data Engineer,Cloud Engineer,Embedded Software Engineer,Game Developer,Blockchain Developer,Site Reliability Engineer (SRE),AI/ML Engineer,Computer Vision Engineer,Natural Language Processing (NLP) Engineer,Cybersecurity Engineer,Automation Test Engineer,DevOps Engineer
    Servlets,"Core Python,",HTML (Hypertext Markup Language),Java Programming Language,Java Programming Language,C# Programming Language,C# Programming Language,"Programming Languages (Python, SQL)","Cloud Platforms (AWS, Azure, GCP)",C/C++ Programming Languages,"Game Engines (Unity, Unreal Engine)","Blockchain Fundamentals (Decentralization, Consensus Mechanisms, Cryptography)",Linux/Unix Systems Administration,Python Programming Language,Python Programming Language,Python Programming Language,Skill,Skill,Skill
    JSP (JavaServer Pages)," Django Framework,",CSS (Cascading Style Sheets),"Spring Framework (Spring Boot, Spring MVC, Spring Data)","Spring Framework (Spring Boot, Spring MVC, Spring Data)",.NET Framework/.NET Core,.NET Framework/.NET Core,Data Warehousing Concepts,"Infrastructure as Code (Terraform, CloudFormation)",Embedded Systems Development,C# Programming Language (for Unity),Smart Contract Development,"Scripting Languages (Python, Bash, Perl)","Machine Learning Algorithms (Supervised Learning, Unsupervised Learning, Reinforcement Learning)","Computer Vision Libraries (OpenCV, scikit-image)","Natural Language Processing Libraries (NLTK, spaCy, Gensim)",Network Security,"Test Automation Frameworks (Selenium, Cypress, Appium)",Linux/Unix System Administration
    JDBC (Java Database Connectivity)," Flask Framework,",JavaScript,Hibernate (or other ORM frameworks),Hibernate (or other ORM frameworks),ASP.NET MVC/WebAPI,ASP.NET MVC/WebAPI,"ETL (Extract, Transform, Load) Processes","Configuration Management (Chef, Puppet, Ansible)",Microcontroller/Microprocessor Architecture,C++ Programming Language (for Unreal Engine),Solidity Programming Language (for Ethereum),"Automation Tools (Ansible, Puppet, Chef)","Deep Learning Frameworks (TensorFlow, PyTorch, Keras)","Deep Learning Frameworks (TensorFlow, PyTorch)","Deep Learning Frameworks (TensorFlow, PyTorch)",Web Application Security,"Programming Languages (Java, Python, JavaScript)","Scripting Languages (Bash, Python)"
    JNDI (Java Naming and Directory Interface)," Python Web Scraping,","Frontend Frameworks (React.js, Angular, Vue.js)",RESTful Web Services,RESTful Web Services,Entity Framework (or other ORM frameworks),Entity Framework (or other ORM frameworks),"Data Modeling (Dimensional Modeling, ER Modeling)","Containerization (Docker, Kubernetes)",RTOS (Real-Time Operating Systems),Game Development Frameworks and Libraries,Web3.js (for Ethereum),"Containerization (Docker, Kubernetes)","Statistical Analysis and Data Manipulation Libraries (NumPy, Pandas)",Image Processing Techniques,"Word Embeddings (Word2Vec, GloVe, FastText)","Operating System Security (Windows, Linux)","Unit Testing Frameworks (JUnit, TestNG, pytest)","Infrastructure as Code (IaC) Tools (Terraform, CloudFormation)"
    JTA (Java Transaction API)," Python GUI Development,","Responsive Design (CSS Grid, Flexbox, media queries)",SOAP,SOAP,LINQ (Language Integrated Query),LINQ (Language Integrated Query),"Database Management Systems (SQL Server, PostgreSQL, MySQL, Oracle)",Microservices Architecture,Embedded Linux,"3D Modeling and Animation Software (Blender, Maya, 3ds Max)",Hyperledger Fabric (for Enterprise Blockchain),"Cloud Platforms (AWS, Azure, GCP)","Data Visualization Libraries (Matplotlib, Seaborn)",Object Detection and Recognition,Sequence-to-Sequence Models,Vulnerability Assessment and Penetration Testing (VAPT),"Behavior-Driven Development (BDD) Tools (Cucumber, SpecFlow)","Configuration Management Tools (Ansible, Chef, Puppet)"
    JMS (Java Message Service)," Python Scripting,",Cross-Browser Compatibility,JDBC (Java Database Connectivity),JDBC (Java Database Connectivity),ASP.NET Identity (or other authentication/authorization mechanisms),ASP.NET Identity (or other authentication/authorization mechanisms),"Big Data Technologies (Hadoop, Spark)","Serverless Computing (AWS Lambda, Azure Functions)",Device Drivers Development,"2D Graphics Software (Adobe Photoshop, GIMP)","Blockchain Development Frameworks (Truffle, Embark)","Infrastructure as Code (Terraform, CloudFormation)",Feature Engineering and Selection,Image Segmentation,Named Entity Recognition (NER),Intrusion Detection and Prevention Systems (IDS/IPS),"API Testing Tools (Postman, REST Assured)","Containerization Technologies (Docker, Kubernetes)"
    Spring Framework," Data Analysis with Python (NumPy, Pandas),",Version Control (Git),Database Management (SQL),Database Management (SQL),ASP.NET Core Identity,ASP.NET Core Identity,Distributed Computing,Networking Fundamentals,Embedded Firmware Development,Physics Simulation,DApp (Decentralized Application) Development,"Monitoring and Alerting Systems (Prometheus, Grafana, ELK Stack)",Model Evaluation and Validation Techniques,Feature Extraction and Descriptor Matching,Part-of-Speech Tagging (POS),Firewall Configuration and Management,"Continuous Integration/Continuous Deployment (CI/CD) Tools (Jenkins, Travis CI, GitLab CI)","Continuous Integration/Continuous Deployment (CI/CD) Tools (Jenkins, GitLab CI/CD, Travis CI)"
    Hibernate," Data Visualization (Matplotlib, Seaborn),",Web Performance Optimization,JPA (Java Persistence API),JPA (Java Persistence API),RESTful Web Services,RESTful Web Services,"Data Pipelines (Airflow, Luigi)",Security Best Practices in Cloud Environments,Bare-Metal Programming,Artificial Intelligence in Games,"Tokenization (ERC-20, ERC-721)",Incident Response and Management,"Natural Language Processing (NLP) Libraries (NLTK, spaCy)",Convolutional Neural Networks (CNNs),Text Classification,Security Information and Event Management (SIEM),"Version Control Systems (Git, SVN)","Version Control Systems (Git, SVN)"
    Struts," Machine Learning (scikit-learn, TensorFlow, PyTorch),",Web Accessibility (a11y),Apache Tomcat (or other servlet containers),"Frontend Development (HTML, CSS, JavaScript)",WCF (Windows Communication Foundation),WCF (Windows Communication Foundation),"Data Integration Tools (Talend, Informatica)",Identity and Access Management (IAM),"Hardware Description Languages (VHDL, Verilog)",Networking and Multiplayer Game Development,Decentralized Finance (DeFi) Protocols,Service Level Objectives (SLOs) and Service Level Indicators (SLIs),Computer Vision Libraries (OpenCV),Transfer Learning,Sentiment Analysis,Security Auditing and Compliance,Test Data Management,"Monitoring and Logging Tools (Prometheus, ELK Stack)"
    HTML," Natural Language Processing (NLTK, spaCy),",Debugging and Troubleshooting,JUnit (or other unit testing frameworks),"Frontend Frameworks (React.js, Angular, Vue.js)",Web Forms (if applicable),Web Forms (if applicable),Data Quality and Governance,"Monitoring and Logging Tools (CloudWatch, Azure Monitor, Stackdriver)",ARM Cortex-M Architecture,Game Design Principles,Cryptocurrency Wallet Integration,Fault Tolerance and Resilience Engineering,Time Series Analysis and Forecasting,Data Augmentation,"Topic Modeling (Latent Dirichlet Allocation, Non-negative Matrix Factorization)",Incident Response and Forensics,Test Case Design and Execution,"Cloud Platforms (AWS, Azure, GCP)"
    RESTful Web Services," Web Development with JavaScript,","Package Managers (npm, Yarn)",Git (Version Control),"HTML Templating Engines (Thymeleaf, FreeMarker)",Razor Pages,Razor Pages,Data Lakes and Data Warehouses,CI/CD (Continuous Integration/Continuous Deployment),"Debugging Tools (GDB, JTAG)",User Interface (UI) Design for Games,Blockchain Security Best Practices,Capacity Planning and Performance Optimization,Recommender Systems,Semantic Segmentation,Text Summarization,Encryption Techniques and Protocols,Web Application Testing,Networking Fundamentals
    SOAP," RESTful API Development with Flask/Django,","Build Tools (webpack, Parcel, Gulp)",Maven (or other build automation tools),"Client-Side Build Tools (Webpack, Babel)",SQL Server (or other relational databases),SQL Server (or other relational databases),"Cloud Platforms (AWS, Azure, GCP)",DevOps Principles and Practices,"Version Control Systems (Git, SVN)",Sound Design and Audio Engineering,"Understanding of Blockchain Scaling Solutions (e.g., Sharding, Plasma)",Reliability Engineering Principles,Clustering and Dimensionality Reduction Techniques,Instance Segmentation,Machine Translation,Identity and Access Management (IAM),Mobile Application Testing,Security Best Practices
    XML and JSON," Unit Testing (pytest),",UI/UX Design Basics,Linux/Unix Basics,Version Control (Git),Database Management (SQL),Database Management (SQL),"NoSQL Databases (MongoDB, Cassandra, Redis)","Scripting Languages (Python, Bash)","Communication Protocols (SPI, I2C, UART, CAN)","Scripting Languages (e.g., Lua for game scripting)",IPFS (InterPlanetary File System),Security Best Practices,Big Data Technologies (Apache Spark),Pose Estimation,Question Answering Systems,Security Assessments and Risk Management,Cross-Browser and Cross-Platform Testing,Orchestration and Automation
    Database Management (SQL)," Version Control with Git,","Testing (Jest, Mocha, Jasmine, Cypress, Selenium)",Microservices Architecture,Maven (or other build automation tools),T-SQL (Transact-SQL),T-SQL (Transact-SQL),"Stream Processing (Kafka, Flink)",Linux/Unix Administration,"Wireless Technologies (Bluetooth, Wi-Fi, Zigbee)","Version Control Systems (Git, SVN)",Oracles and Data Feeds,Networking Fundamentals,"Cloud Platforms (AWS, Azure, GCP)",Optical Character Recognition (OCR),Syntax and Dependency Parsing,Security Architecture Design,"Load and Performance Testing (JMeter, Gatling)","Container Orchestration (Docker Swarm, Kubernetes)"
    Apache Tomcat," Linux/Unix Basics,",Continuous Integration/Continuous Deployment (CI/CD),"Design Patterns (Singleton, Factory, MVC, etc.)",Linux/Unix Basics,MVC (Model-View-Controller) Architecture,"Frontend Development (HTML, CSS, JavaScript)","Data Visualization Tools (Tableau, Power BI)",Database Management Systems (SQL and NoSQL),Sensor Interfacing,Game Testing and Quality Assurance,Permissioned and Permissionless Blockchains,Database Administration,"Model Deployment and Serving (TensorFlow Serving, Flask, FastAPI)",3D Computer Vision,Language Modeling,Cloud Security Principles,Test Reporting and Documentation,Microservices Architecture
    JBoss," Containerization (Docker),",,"Cloud Platforms (AWS, Azure, GCP)",Microservices Architecture,MVVM (Model-View-ViewModel) Architecture,"Frontend Frameworks (React.js, Angular, Vue.js)",Version Control (Git),High Availability and Disaster Recovery,Low-Power Design Techniques,Game Optimization Techniques,Blockchain Governance Models,CI/CD (Continuous Integration/Continuous Deployment),"Version Control Systems (Git, SVN)",Camera Calibration,BERT (Bidirectional Encoder Representations from Transformers),Secure Coding Practices,"Code Analysis Tools (SonarQube, ESLint)",Agile Methodologies
    IBM WebSphere," Cloud Platforms (AWS, Azure, GCP),",,Containerization (Docker),"Design Patterns (Singleton, Factory, MVC, etc.)","Dependency Injection (e.g., Unity, Autofac)","HTML Templating Engines (Razor, Handlebars, etc.)",Linux/Unix Basics,Automated Backup and Restore Procedures,Signal Processing Algorithms,Cross-Platform Development,"Understanding of Consensus Algorithms (e.g., Proof of Work, Proof of Stake)","Version Control Systems (Git, SVN)",Understanding of Ethics and Bias in AI/ML,Point Cloud Processing,Transformer Architecture,Threat Intelligence Analysis,Browser Developer Tools,Collaboration and Communication Skills
    Git (Version Control), Agile Methodology,,CI/CD (Continuous Integration/Continuous Deployment),"Cloud Platforms (AWS, Azure, GCP)","Unit Testing (NUnit, xUnit)","Client-Side Build Tools (Webpack, Gulp)",CI/CD (Continuous Integration/Continuous Deployment),Cost Management and Optimization,Embedded Security Principles,Game Monetization Strategies,Understanding of Non-Fungible Tokens (NFTs),Collaboration and Communication Skills,Quantitative and Qualitative Research Skills,"Cloud Platforms (AWS, Azure, GCP)",Attention Mechanisms,Social Engineering Awareness and Prevention,Database Testing,Problem-Solving and Analytical Skills
    JUnit,,,"Logging and Monitoring Tools (e.g., Log4j, Prometheus)",Containerization (Docker),"Frontend Development (HTML, CSS, JavaScript)","JavaScript Libraries/Frameworks (jQuery, Bootstrap, etc.)",Debugging and Troubleshooting,Compliance and Governance,Board Bring-up and Hardware Integration,Virtual Reality (VR) or Augmented Reality (AR) Development,Smart Contract Auditing,On-Call Support and Pager Duty Rotation,Critical Thinking and Problem-Solving Abilities,"Version Control Systems (Git, SVN)",Transfer Learning in NLP,Wireless Network Security,Agile Testing Principles and Methodologies,
    Selenium,,,"Security Best Practices (e.g., OWASP)",CI/CD (Continuous Integration/Continuous Deployment),"Frontend Frameworks (React.js, Angular, Vue.js) if applicable",Version Control (Git),,Troubleshooting and Debugging,Testing and Verification,Understanding of Game Industry Trends and Platforms,"Version Control Systems (Git, SVN)",,,Problem-Solving and Analytical Skills,"Cloud Platforms (AWS, Azure, GCP)",Physical Security Measures,Problem-Solving and Analytical Skills,
    Troubleshooting and Debugging,,,Troubleshooting and Debugging,"Logging and Monitoring Tools (e.g., Log4j, Prometheus)",Git (Version Control),Visual Studio (or other IDEs),,,,Creative Problem-Solving Skills,,,,,"Version Control Systems (Git, SVN)",Security Policy Development and Enforcement,,
    Effective Communication,,,,"Security Best Practices (e.g., OWASP)",Visual Studio (or other IDEs),Azure DevOps (or other DevOps tools),,,,,,,,,Problem-Solving and Analytical Skills,Continual Learning and Adaptability to New Threats,,
    Teamwork,,,,"Unit Testing (JUnit, Mockito)",Azure DevOps (or other DevOps tools),CI/CD (Continuous Integration/Continuous Deployment),,,,,,,,,,,,
    Time Management,,,,Integration Testing,CI/CD (Continuous Integration/Continuous Deployment),"Design Patterns (Factory, Singleton, Repository, etc.)",,,,,,,,,,,,
    Design Patterns,,,,End-to-End Testing (Selenium),"Design Patterns (Factory, Singleton, Repository, etc.)",Object-Oriented Programming (OOP) Principles,,,,,,,,,,,,
    Security Best Practices,,,,UI/UX Design Basics,Object-Oriented Programming (OOP) Principles,"Dependency Injection (e.g., Unity, Autofac)",,,,,,,,,,,,
    Servlets,,,,,Debugging and Troubleshooting,"Unit Testing (NUnit, xUnit)",,,,,,,,,,,,
,,,,,,Integration Testing,,,,,,,,,,,,
,,,,,,End-to-End Testing (Selenium),,,,,,,,,,,,
,,,,,,Debugging and Troubleshooting,,,,,,,,,,,,